{
  "authorization_note": "Repository owner explicitly authorized agent verification and merge in Codex task 019f652b-be20-7681-9e77-3179f1d72a93 on 2026-08-12.",
  "decisions": [
    {"case_id": "microchip-mcp9808-ds20005095b-2018/pinout-positive", "note": "Corrected exact-hash crop inspected; complete MSOP-8 labels and lead order are visible.", "outcome": "accepted"},
    {"case_id": "microchip-mcp9808-ds20005095b-2018/table-positive", "note": "Exact-hash Table 3-1 and all MSOP pin functions inspected.", "outcome": "accepted"},
    {"case_id": "microchip-mcp9808-ds20005095b-2018/package-positive", "note": "Exact-hash product system and MCP9808T-E/MS example inspected.", "outcome": "accepted"},
    {"case_id": "microchip-mcp9808-ds20005095b-2018/wrong-package", "note": "MSOP /MS versus DFN /MC mismatch inspected.", "outcome": "accepted"},
    {"case_id": "microchip-mcp9808-ds20005095b-2018/wrong-variant", "note": "MCP9808 versus neighboring MCP9801 identity mismatch inspected.", "outcome": "accepted"},
    {"case_id": "microchip-mcp9808-ds20005095b-2018/wrong-view", "note": "Corrected complete top-view crop and opposing bottom-view claim inspected.", "outcome": "accepted"},
    {"case_id": "microchip-mcp9808-ds20005095b-2018/wrong-figure-block-as-pinout", "note": "Functional-block negative inspected and is visibly not a package pinout.", "outcome": "accepted"},
    {"case_id": "microchip-mcp9600-ds20005426j-2025/pinout-positive", "note": "Corrected exact-hash crop inspected; all MCP9600 MQFN perimeter labels are visible.", "outcome": "accepted"},
    {"case_id": "microchip-mcp9600-ds20005426j-2025/table-positive", "note": "Exact-hash Table 3-1 mapping inspected.", "outcome": "accepted"},
    {"case_id": "microchip-mcp9600-ds20005426j-2025/package-positive", "note": "Exact MCP9600T-E/MX order example and /MX definition inspected.", "outcome": "accepted"},
    {"case_id": "microchip-mcp9600-ds20005426j-2025/wrong-package", "note": "MQFN /MX versus VFLGA /3YW mismatch inspected.", "outcome": "accepted"},
    {"case_id": "microchip-mcp9600-ds20005426j-2025/wrong-variant", "note": "MCP9600 versus separately listed MCP9601 variant inspected.", "outcome": "accepted"},
    {"case_id": "microchip-mcp9600-ds20005426j-2025/wrong-view", "note": "Corrected complete top-view crop and opposing bottom-view claim inspected.", "outcome": "accepted"},
    {"case_id": "microchip-mcp9600-ds20005426j-2025/wrong-figure-block-as-pinout", "note": "Thermocouple-converter block-diagram negative inspected.", "outcome": "accepted"},
    {"case_id": "microchip-pac1934-ds20005850e-2019/pinout-positive", "note": "Exact-hash UQFN top-view diagram and all four sense channels inspected.", "outcome": "accepted"},
    {"case_id": "microchip-pac1934-ds20005850e-2019/table-positive", "note": "Exact-hash PAC1934 pin-description table inspected.", "outcome": "accepted"},
    {"case_id": "microchip-pac1934-ds20005850e-2019/package-positive", "note": "Exact PAC1934T-I/JQ order example and JQ package definition inspected.", "outcome": "accepted"},
    {"case_id": "microchip-pac1934-ds20005850e-2019/wrong-package", "note": "UQFN /JQ versus WLCSP /J6CX mismatch inspected.", "outcome": "accepted"},
    {"case_id": "microchip-pac1934-ds20005850e-2019/wrong-variant", "note": "Four-channel PAC1934 versus three-channel PAC1933 mismatch inspected.", "outcome": "accepted"},
    {"case_id": "microchip-pac1934-ds20005850e-2019/wrong-view", "note": "Explicit top-view label and opposing bottom-view claim inspected.", "outcome": "accepted"},
    {"case_id": "microchip-pac1934-ds20005850e-2019/wrong-figure-block-as-pinout", "note": "Power-monitor device-block negative inspected.", "outcome": "accepted"},
    {"case_id": "microchip-mcp8024-ds20005228a-2013/pinout-positive", "note": "Exact-hash QFN-40 pin map inspected with bounded package context.", "outcome": "accepted"},
    {"case_id": "microchip-mcp8024-ds20005228a-2013/table-positive", "note": "All QFN pin-number, signal, type, and description rows inspected.", "outcome": "accepted"},
    {"case_id": "microchip-mcp8024-ds20005228a-2013/package-positive", "note": "Exact MCP8024-H/MP example and QFN-40 definition inspected.", "outcome": "accepted"},
    {"case_id": "microchip-mcp8024-ds20005228a-2013/wrong-package", "note": "QFN /MP versus TQFP /PT mismatch inspected.", "outcome": "accepted"},
    {"case_id": "microchip-mcp8024-ds20005228a-2013/wrong-variant", "note": "MCP8024 versus neighboring MCP8026 identity mismatch inspected.", "outcome": "accepted"},
    {"case_id": "microchip-mcp8024-ds20005228a-2013/wrong-view", "note": "QFN top-view ordering and opposing bottom-view claim inspected.", "outcome": "accepted"},
    {"case_id": "microchip-mcp8024-ds20005228a-2013/wrong-figure-block-as-pinout", "note": "Motor-control functional-block negative inspected.", "outcome": "accepted"},
    {"case_id": "bosch-bmi160-rev-1-0-2020-11/pinout-positive", "note": "Corrected crop isolates Figure 31 top view; all fourteen pads and pin-one marker are visible.", "outcome": "accepted"},
    {"case_id": "bosch-bmi160-rev-1-0-2020-11/table-positive", "note": "Exact-hash Table 30 mapping for all fourteen pads inspected.", "outcome": "accepted"},
    {"case_id": "bosch-bmi160-rev-1-0-2020-11/package-positive", "note": "Exact BMI160 LGA dimensions and package outline inspected.", "outcome": "accepted"},
    {"case_id": "bosch-bmi160-rev-1-0-2020-11/wrong-package", "note": "LGA-14 2.5x3.0 versus LGA-16 3x3 mismatch inspected.", "outcome": "accepted"},
    {"case_id": "bosch-bmi160-rev-1-0-2020-11/wrong-variant", "note": "BMI160 versus neighboring BMI270 identity mismatch inspected.", "outcome": "accepted"},
    {"case_id": "bosch-bmi160-rev-1-0-2020-11/wrong-view", "note": "Isolated Figure 31 top view and opposing bottom-view claim inspected.", "outcome": "accepted"},
    {"case_id": "bosch-bmi160-rev-1-0-2020-11/wrong-figure-block-as-pinout", "note": "Internal data-flow block-diagram negative inspected.", "outcome": "accepted"}
  ],
  "packet_sha256": "477d8d601a26533cbc181022c197e462120ee81b31a97253beadce850a113fcd",
  "registry_sha256": "c66991f41d55b2e5cfa41990a66e49133a7fe81b1ff7d622a3565e789ccc0206",
  "reviewed_at": "2026-08-12T13:10:00Z",
  "reviewer": "agent:codex-gpt5",
  "schema_version": "dsvire.visual-agent-review-decision.v1",
  "verification_summary": {
    "cases": 35,
    "documents": 5,
    "exact_source_hashes": 5,
    "excluded_findings": [
      "Rejected initial packet 8d390416801262fde619bc2a0e693eef7b2750580443d54ce2086dc6ccf04942 because MCP9808 and MCP9600 pin labels were clipped and the BMI160 positive crop included both orientations; corrected before acceptance.",
      "ST LIS3DH was excluded after repeated official-CDN timeouts; no unofficial mirror bytes were admitted."
    ]
  }
}
