{
  "authorization_note": "Repository owner explicitly authorized agent verification and merge in Codex task 019f652b-be20-7681-9e77-3179f1d72a93 on 2026-08-12.",
  "decisions": [
    {"case_id":"nexperia-74hc595-rev-12-2024-03/pinout-positive","note":"Exact-hash SO16 top-view lead map and signal labels inspected.","outcome":"accepted"},
    {"case_id":"nexperia-74hc595-rev-12-2024-03/table-positive","note":"Complete pin-description mapping inspected.","outcome":"accepted"},
    {"case_id":"nexperia-74hc595-rev-12-2024-03/package-positive","note":"Dimensioned SOT109-1 SO16 outline inspected.","outcome":"accepted"},
    {"case_id":"nexperia-74hc595-rev-12-2024-03/wrong-package","note":"SO16 versus TSSOP16 mismatch inspected.","outcome":"accepted"},
    {"case_id":"nexperia-74hc595-rev-12-2024-03/wrong-variant","note":"74HC595D versus 74HCT595D identity mismatch inspected.","outcome":"accepted"},
    {"case_id":"nexperia-74hc595-rev-12-2024-03/wrong-view","note":"Top-view crop and opposing bottom-view claim inspected.","outcome":"accepted"},
    {"case_id":"nexperia-74hc595-rev-12-2024-03/wrong-figure-timing-as-pinout","note":"Timing-diagram negative is visibly not a pinout.","outcome":"accepted"},
    {"case_id":"vishay-vo617a-rev-2-8-2025-01/pinout-positive","note":"Corrected crop isolates the four-pin optocoupler assignment.","outcome":"accepted"},
    {"case_id":"vishay-vo617a-rev-2-8-2025-01/table-positive","note":"Ordering grammar and exact -3X007T row inspected.","outcome":"accepted"},
    {"case_id":"vishay-vo617a-rev-2-8-2025-01/package-positive","note":"Option 7 SMD drawing and marking context inspected.","outcome":"accepted"},
    {"case_id":"vishay-vo617a-rev-2-8-2025-01/wrong-package","note":"Option 7 SMD versus DIP-4 mismatch inspected.","outcome":"accepted"},
    {"case_id":"vishay-vo617a-rev-2-8-2025-01/wrong-variant","note":"CTR bin -3 versus -2 mismatch inspected.","outcome":"accepted"},
    {"case_id":"vishay-vo617a-rev-2-8-2025-01/wrong-view","note":"Corrected top-side pin assignment and bottom-view claim inspected.","outcome":"accepted"},
    {"case_id":"vishay-vo617a-rev-2-8-2025-01/wrong-figure-graph-as-pinout","note":"Performance-graph negative is visibly not a pinout.","outcome":"accepted"},
    {"case_id":"silicon-labs-cp2102n-rev-1-5/pinout-positive","note":"Complete QFN28 top-view pinout inspected.","outcome":"accepted"},
    {"case_id":"silicon-labs-cp2102n-rev-1-5/table-positive","note":"Full QFN28 pin-definition table inspected.","outcome":"accepted"},
    {"case_id":"silicon-labs-cp2102n-rev-1-5/package-positive","note":"Dimensioned QFN28 5x5 mm drawing inspected.","outcome":"accepted"},
    {"case_id":"silicon-labs-cp2102n-rev-1-5/wrong-package","note":"QFN28 5x5 versus QFN24 4x4 mismatch inspected.","outcome":"accepted"},
    {"case_id":"silicon-labs-cp2102n-rev-1-5/wrong-variant","note":"A02 versus A01 hardware-revision mismatch inspected.","outcome":"accepted"},
    {"case_id":"silicon-labs-cp2102n-rev-1-5/wrong-view","note":"Explicit QFN top view and bottom-view claim inspected.","outcome":"accepted"},
    {"case_id":"silicon-labs-cp2102n-rev-1-5/wrong-figure-connection-as-pinout","note":"Regulator connection-diagram negative inspected.","outcome":"accepted"},
    {"case_id":"microchip-lan8720a-ds00002165b-2016/pinout-positive","note":"Complete 24-QFN top-view signal assignment inspected.","outcome":"accepted"},
    {"case_id":"microchip-lan8720a-ds00002165b-2016/table-positive","note":"Complete 24-QFN pin-assignment table inspected.","outcome":"accepted"},
    {"case_id":"microchip-lan8720a-ds00002165b-2016/package-positive","note":"Dimensioned 24-QFN punch outline inspected.","outcome":"accepted"},
    {"case_id":"microchip-lan8720a-ds00002165b-2016/wrong-package","note":"Punch QFN CP versus saw SQFN CZ mismatch inspected.","outcome":"accepted"},
    {"case_id":"microchip-lan8720a-ds00002165b-2016/wrong-variant","note":"LAN8720A versus LAN8710A identity mismatch inspected.","outcome":"accepted"},
    {"case_id":"microchip-lan8720a-ds00002165b-2016/wrong-view","note":"Explicit top view and opposing bottom-view claim inspected.","outcome":"accepted"},
    {"case_id":"microchip-lan8720a-ds00002165b-2016/wrong-figure-block-as-pinout","note":"System/architecture block-diagram negative inspected.","outcome":"accepted"},
    {"case_id":"atmel-mxt336t-rev-3-1-bx-2016-10/pinout-positive","note":"Complete UQFN-56 top-view configuration inspected.","outcome":"accepted"},
    {"case_id":"atmel-mxt336t-rev-3-1-bx-2016-10/table-positive","note":"UQFN pin listing and unused-pin behavior inspected.","outcome":"accepted"},
    {"case_id":"atmel-mxt336t-rev-3-1-bx-2016-10/package-positive","note":"Dimensioned 56-pin 6x6 mm UQFN drawing inspected.","outcome":"accepted"},
    {"case_id":"atmel-mxt336t-rev-3-1-bx-2016-10/wrong-package","note":"UQFN-56 versus TQFP-56 mismatch inspected.","outcome":"accepted"},
    {"case_id":"atmel-mxt336t-rev-3-1-bx-2016-10/wrong-variant","note":"Tape-and-reel MAUR versus tray MAU mismatch inspected.","outcome":"accepted"},
    {"case_id":"atmel-mxt336t-rev-3-1-bx-2016-10/wrong-view","note":"Explicit UQFN top view and bottom-view claim inspected.","outcome":"accepted"},
    {"case_id":"atmel-mxt336t-rev-3-1-bx-2016-10/wrong-figure-schematic-as-pinout","note":"64-ball application schematic is visibly not the selected UQFN pinout.","outcome":"accepted"}
  ],
  "packet_sha256": "52fb8c2a822b65909591aa8f8078bf58f9883ee2c5ffb8ab9b0bdf70af9ab471",
  "registry_sha256": "10bd27c5444e8a54f07e67a5f891bf0d5979f0653c2d346012e94e9a949aa35f",
  "reviewed_at": "2026-08-12T14:20:00Z",
  "reviewer": "agent:codex-gpt5",
  "schema_version": "dsvire.visual-agent-review-decision.v1",
  "verification_summary": {
    "cases": 35,
    "documents": 5,
    "exact_source_hashes": 5,
    "excluded_findings": [
      "Rejected initial packet 62684ee82a7fc98b1231e29ec063b96fecf333d8ce73b17a73a9f8c37d93a5ef because the VO617A pinout crops omitted the four-pin schematic; corrected before acceptance.",
      "FTDI and Infineon candidate sources were excluded after official vendor endpoints denied or returned empty PDF bytes; no unofficial mirrors were admitted."
    ]
  }
}
